{
  "artifact_type": "credential_resolution_plan",
  "artifact_version": "0.7",
  "dry_run": true,
  "binding_id": "auth-binding-1",
  "binding_revision": "auth-binding-rev-1",
  "adapter_id": "adapter-payment-refund",
  "adapter_revision": "adapter-rev-1",
  "tool_id": "tool-payment-refund",
  "tool_revision": "tool-rev-1",
  "context_hash": "context-hash-subject-1-client-1-workspace-1",
  "selected_credential": {
    "account_id": "account-1",
    "credential_handle": "credential-handle-1",
    "provider_account_ref": "provider-account-1",
    "mode": "oauth2_1",
    "secret_locator_included": false,
    "secret_material_included": false
  },
  "checks": [],
  "scope_check": {
    "required": [
      "payment:refund"
    ],
    "granted": [
      "payment:refund"
    ],
    "missing": []
  },
  "audience_check": {
    "required": true,
    "expected": "https://api.example.test",
    "matched": true
  },
  "tenant_check": {
    "required_dimensions": [
      "subject",
      "client",
      "workspace"
    ],
    "matched": true
  },
  "injection_envelope": {
    "strategy": "bearer_token",
    "location": "header",
    "name": "Authorization",
    "prefix": "Bearer",
    "signing_algorithm": null,
    "credential_handle": "credential-handle-1",
    "secret_material_included": false
  },
  "ready": true,
  "warnings": [],
  "errors": [],
  "integrity": {
    "algorithm": "sha256",
    "digest": "163251706bfe87f83f874b7b3670446d4b2bb92b87a7f4f896feb1238d402af1"
  }
}
