{
  "artifact_type": "credential_resolution_plan",
  "artifact_version": "0.7",
  "dry_run": true,
  "binding_id": "auth-binding:auth-customer-api",
  "binding_revision": "58a1559c9ec05c5e12fe481aa379501d35bed4f4cfb2db5083b606d96c3dbfc2",
  "adapter_id": "adapter:customer_get",
  "adapter_revision": "890e77b35d1dcd1d716d29cf47c25b5e049fc5ccca2747e8ed1adf7ded07d75e",
  "tool_id": "tool:customer_get",
  "tool_revision": "customer-get-auth-rev-1",
  "context_hash": "b6766d45aa13ed602201438cb7e1dc203a46dfa0b115e314100f564a7a8c5184",
  "selected_credential": {
    "account_id": "credential-account-customer-001",
    "credential_handle": "credential-handle-customer-001",
    "provider_account_ref": "account-customer-001",
    "mode": "oauth2_1",
    "secret_locator_included": false,
    "secret_material_included": false
  },
  "checks": [
    {
      "code": "TOKEN_PASSTHROUGH_FORBIDDEN",
      "status": "pass",
      "message": "Provider credentials are resolved independently; incoming client tokens are never forwarded."
    },
    {
      "code": "CREDENTIAL_ACCOUNT_MATCH",
      "status": "pass",
      "message": "Matched credential account credential-account-customer-001."
    },
    {
      "code": "SCOPE_COVERAGE",
      "status": "pass",
      "message": "Credential grants every required scope."
    },
    {
      "code": "AUDIENCE_VALIDATION",
      "status": "pass",
      "message": "Credential audience matches https://api.example.test."
    },
    {
      "code": "TENANT_BINDING",
      "status": "pass",
      "message": "Credential matches the required tenant dimensions."
    }
  ],
  "scope_check": {
    "required": [
      "customer:read"
    ],
    "granted": [
      "customer:read"
    ],
    "missing": []
  },
  "audience_check": {
    "required": true,
    "expected": "https://api.example.test",
    "matched": true
  },
  "tenant_check": {
    "required_dimensions": [
      "client",
      "provider",
      "provider_account",
      "scope_set",
      "subject",
      "workspace"
    ],
    "matched": true
  },
  "injection_envelope": {
    "strategy": "bearer_token",
    "location": "header",
    "name": "Authorization",
    "prefix": "Bearer",
    "signing_algorithm": null,
    "credential_handle": "credential-handle-customer-001",
    "secret_material_included": false
  },
  "ready": true,
  "warnings": [],
  "errors": [],
  "integrity": {
    "algorithm": "sha256",
    "digest": "38f2f8035a3566e3584242cee7415eb1a5b8f9858aeaaffe94306c285eab91da"
  }
}
